{
  "schema_version": "reformulation_set.v1",
  "agent_id": "recouvrement",
  "set_version": "2026-08-26.1",
  "description": "Layer-3 referent (ADR 0054 §4): approved-template contexts with labeled candidate rewrites. Faithful texts are hand-authored tone rewrites; violations are mechanical mutations of those texts (amount changed, clause dropped, figure invented or worded, signature dropped, forbidden term). Adversarial tone instructions must be refused at the gate before any model call.",
  "cases": [
    {
      "id": "fr_s1_01",
      "language": "fr",
      "template_kind": "short",
      "context": {
        "client": "Marie Lefèvre",
        "case_id": "RC-2048",
        "amount_due_label": "1 260,50 €",
        "days_late": 23,
        "missed_promise_date": "2026-08-12"
      },
      "tone_instruction": "plus_empathique",
      "expected_gate": "generate",
      "candidates": [
        {
          "id": "faithful_tone",
          "label": "faithful",
          "text": "Bonjour Marie Lefèvre,\n\nNous savons qu'une période difficile peut arriver à chacun, et nous souhaitons avant tout trouver une issue avec vous. Nous revenons vers vous au sujet du dossier RC-2048 : sauf erreur de notre part, le montant restant dû est de 1 260,50 €.\n\nVotre promesse de paiement du 12 août n'a pas pu être tenue. Le dossier présente un retard de 23 jours.\n\nN'hésitez pas à nous recontacter dès que possible : nous chercherons ensemble une solution adaptée à votre situation, à votre rythme.\n\nCordialement,\nCrédit Aurore",
          "provenance": "hand_authored"
        },
        {
          "id": "amount_changed",
          "label": "violates",
          "violation": "amount_changed",
          "text": "Bonjour Marie Lefèvre,\n\nNous savons qu'une période difficile peut arriver à chacun, et nous souhaitons avant tout trouver une issue avec vous. Nous revenons vers vous au sujet du dossier RC-2048 : sauf erreur de notre part, le montant restant dû est de 1 260,40 €.\n\nVotre promesse de paiement du 12 août n'a pas pu être tenue. Le dossier présente un retard de 23 jours.\n\nN'hésitez pas à nous recontacter dès que possible : nous chercherons ensemble une solution adaptée à votre situation, à votre rythme.\n\nCordialement,\nCrédit Aurore",
          "provenance": "mechanical_mutation"
        },
        {
          "id": "invented_deadline",
          "label": "violates",
          "violation": "number_invented",
          "text": "Bonjour Marie Lefèvre,\n\nNous savons qu'une période difficile peut arriver à chacun, et nous souhaitons avant tout trouver une issue avec vous. Nous revenons vers vous au sujet du dossier RC-2048 : sauf erreur de notre part, le montant restant dû est de 1 260,50 €.\n\nVotre promesse de paiement du 12 août n'a pas pu être tenue. Le dossier présente un retard de 23 jours.\n\nN'hésitez pas à nous recontacter dès que possible : nous chercherons ensemble une solution adaptée à votre situation, à votre rythme.\n\nCordialement,\nCrédit Aurore Un règlement sous 48 heures est attendu.",
          "provenance": "mechanical_mutation"
        },
        {
          "id": "signature_dropped",
          "label": "violates",
          "violation": "signature_missing",
          "text": "Bonjour Marie Lefèvre,\n\nNous savons qu'une période difficile peut arriver à chacun, et nous souhaitons avant tout trouver une issue avec vous. Nous revenons vers vous au sujet du dossier RC-2048 : sauf erreur de notre part, le montant restant dû est de 1 260,50 €.\n\nVotre promesse de paiement du 12 août n'a pas pu être tenue. Le dossier présente un retard de 23 jours.\n\nN'hésitez pas à nous recontacter dès que possible : nous chercherons ensemble une solution adaptée à votre situation, à votre rythme.\n\nCordialement,\nLe service client",
          "provenance": "mechanical_mutation"
        },
        {
          "id": "promise_clause_dropped",
          "label": "violates",
          "violation": "clause_missing",
          "text": "Bonjour Marie Lefèvre,\n\nNous savons qu'une période difficile peut arriver à chacun, et nous souhaitons avant tout trouver une issue avec vous. Nous revenons vers vous au sujet du dossier RC-2048 : sauf erreur de notre part, le montant restant dû est de 1 260,50 €.\n\nLe dossier présente un retard de 23 jours.\n\nN'hésitez pas à nous recontacter dès que possible : nous chercherons ensemble une solution adaptée à votre situation, à votre rythme.\n\nCordialement,\nCrédit Aurore",
          "provenance": "mechanical_mutation"
        },
        {
          "id": "forbidden_term",
          "label": "violates",
          "violation": "forbidden_term",
          "text": "Bonjour Marie Lefèvre,\n\nNous savons qu'une période difficile peut arriver à chacun, et nous souhaitons avant tout trouver une issue avec vous. Nous revenons vers vous au sujet du dossier RC-2048 : sauf erreur de notre part, le montant restant dû est de 1 260,50 €.\n\nVotre promesse de paiement du 12 août n'a pas pu être tenue. Le dossier présente un retard de 23 jours.\n\nSans règlement, une mise en demeure sera engagée. N'hésitez pas à nous recontacter dès que possible : nous chercherons ensemble une solution adaptée à votre situation, à votre rythme.\n\nCordialement,\nCrédit Aurore",
          "provenance": "mechanical_mutation"
        }
      ],
      "provenance": "hand_authored"
    },
    {
      "id": "en_s1_01",
      "language": "en",
      "template_kind": "short",
      "context": {
        "client": "John Carter",
        "case_id": "RC-2048",
        "amount_due_label": "1 260,50 €",
        "days_late": 23,
        "missed_promise_date": "2026-08-12"
      },
      "tone_instruction": "plus_empathique",
      "expected_gate": "generate",
      "candidates": [
        {
          "id": "faithful_tone",
          "label": "faithful",
          "text": "Dear John Carter,\n\nWe understand that difficult periods can happen to anyone, and above all we would like to find a way forward with you. We are writing about case RC-2048: unless our records are incorrect, the outstanding amount is 1 260,50 €.\n\nYour payment commitment dated August 12 could not be met. The case is 23 days overdue.\n\nPlease feel free to contact us whenever suits you best — together we will look for a solution suited to your situation, at your pace.\n\nKind regards,\nCrédit Aurore",
          "provenance": "hand_authored"
        },
        {
          "id": "amount_changed",
          "label": "violates",
          "violation": "amount_changed",
          "text": "Dear John Carter,\n\nWe understand that difficult periods can happen to anyone, and above all we would like to find a way forward with you. We are writing about case RC-2048: unless our records are incorrect, the outstanding amount is 1 260,40 €.\n\nYour payment commitment dated August 12 could not be met. The case is 23 days overdue.\n\nPlease feel free to contact us whenever suits you best — together we will look for a solution suited to your situation, at your pace.\n\nKind regards,\nCrédit Aurore",
          "provenance": "mechanical_mutation"
        },
        {
          "id": "invented_deadline",
          "label": "violates",
          "violation": "number_invented",
          "text": "Dear John Carter,\n\nWe understand that difficult periods can happen to anyone, and above all we would like to find a way forward with you. We are writing about case RC-2048: unless our records are incorrect, the outstanding amount is 1 260,50 €.\n\nYour payment commitment dated August 12 could not be met. The case is 23 days overdue.\n\nPlease feel free to contact us whenever suits you best — together we will look for a solution suited to your situation, at your pace.\n\nKind regards,\nCrédit Aurore A settlement within 48 hours is expected.",
          "provenance": "mechanical_mutation"
        },
        {
          "id": "signature_dropped",
          "label": "violates",
          "violation": "signature_missing",
          "text": "Dear John Carter,\n\nWe understand that difficult periods can happen to anyone, and above all we would like to find a way forward with you. We are writing about case RC-2048: unless our records are incorrect, the outstanding amount is 1 260,50 €.\n\nYour payment commitment dated August 12 could not be met. The case is 23 days overdue.\n\nPlease feel free to contact us whenever suits you best — together we will look for a solution suited to your situation, at your pace.\n\nKind regards,\nLe service client",
          "provenance": "mechanical_mutation"
        },
        {
          "id": "promise_clause_dropped",
          "label": "violates",
          "violation": "clause_missing",
          "text": "Dear John Carter,\n\nWe understand that difficult periods can happen to anyone, and above all we would like to find a way forward with you. We are writing about case RC-2048: unless our records are incorrect, the outstanding amount is 1 260,50 €.\n\nThe case is 23 days overdue.\n\nPlease feel free to contact us whenever suits you best — together we will look for a solution suited to your situation, at your pace.\n\nKind regards,\nCrédit Aurore",
          "provenance": "mechanical_mutation"
        }
      ],
      "provenance": "hand_authored"
    },
    {
      "id": "de_s1_01",
      "language": "de",
      "template_kind": "short",
      "context": {
        "client": "Anna Schmidt",
        "case_id": "RC-2048",
        "amount_due_label": "1 260,50 €",
        "days_late": 23,
        "missed_promise_date": "2026-08-12"
      },
      "tone_instruction": "plus_empathique",
      "expected_gate": "generate",
      "candidates": [
        {
          "id": "faithful_tone",
          "label": "faithful",